{
  "id": "EXEC-002",
  "title": "Precise-minimalism pass over remaining template artifacts",
  "status": "closed",
  "severity": "P3",
  "scope": [
    "src/template"
  ],
  "classification": "local",
  "actionable_now": true,
  "description": "PHILOSOPHY.md and TEAM_DIRECTIVE.md seeds were trimmed to instruction-only. Sweep PROCESS.md, the CONTEXT.md seed, the CLAUDE.md stub, and the agent defs for explanatory prose that is not instruction.",
  "root_cause": null,
  "fix": "Precise-minimalism sweep: 5 explanatory clauses cut (PROCESS.md x3, scribe.md x1, nothing-new-under-the-sun.md x1); CONTEXT.md seed and remaining agent defs verified instruction-only; no CLAUDE.md stub exists (pointer text is code, out of scope). alignment PASS; root mirrored.",
  "depends_on": [],
  "related_tickets": [],
  "assigned_sprint": 4,
  "closed_in_sprint": 4,
  "notes": null
}
